TestNone,"Patient states that they are 'feeling terrific' Weight at or below recommended level"
TestBorderline,"Patient states that they are feeling a great deal of stress at work Patient also complains that their hearing seems Abnormal as of late"
TestBorderline,"Patient states that they have had a Reaction to medication within last 3 months Patient also complains that their hearing continues to be problematic"
TestInDanger,"Patient states that they are short term Smoker "
TestInDanger,"Patient states that they quit within last year Patient also complains that of Abnormal breathing spells Lab reports Cholesterol LDL high"
TestEarlyOnset,"Patient states that walking up stairs has become difficult Patient also complains that they are having shortness of breath Lab results indicate Antibodies present elevated Reaction to medication"
TestEarlyOnset,"Patient states that they are experiencing back pain when seated for a long time"
TestEarlyOnset,"Patient states that they are a short term Smoker Hemoglobin A1C above recommended level"
TestEarlyOnset,"Patient states that Body Height, Body Weight, Cholesterol, Dizziness and Reaction"
